{
  "$schema": "https://json-schema.org/draft/2020-12/schema",
  "$id": "https://schemas.ismail-elkorchi.dev/terminal-ui/accessible-snapshot.schema.json",
  "type": "object",
  "required": ["schemaVersion", "source", "root", "focusPath", "diagnostics"],
  "properties": {
    "schemaVersion": { "const": "terminal-ui.accessible-snapshot.v1" },
    "source": { "enum": ["prompt", "tui", "widget", "progress"] },
    "title": { "type": "string" },
    "root": { "$ref": "#/$defs/accessibleNode" },
    "focusPath": { "type": "array", "items": { "type": "string" } },
    "diagnostics": {
      "type": "array",
      "items": { "$ref": "https://schemas.ismail-elkorchi.dev/terminal-ui/terminal-diagnostic.schema.json" }
    }
  },
  "additionalProperties": false,
  "$defs": {
    "accessibleNode": {
      "type": "object",
      "required": ["id", "role"],
      "properties": {
        "id": { "type": "string", "minLength": 1 },
        "role": {
          "enum": [
            "application",
            "dialog",
            "status",
            "progressbar",
            "textbox",
            "button",
            "checkbox",
            "radio",
            "listbox",
            "option",
            "menu",
            "menuitem",
            "table",
            "row",
            "cell",
            "text"
          ]
        },
        "label": { "type": "string" },
        "value": {
          "anyOf": [
            { "type": "string" },
            { "type": "number" },
            { "type": "boolean" },
            { "type": "null" }
          ]
        },
        "focused": { "type": "boolean" },
        "selected": { "type": "boolean" },
        "disabled": { "type": "boolean" },
        "expanded": { "type": "boolean" },
        "checked": { "anyOf": [{ "type": "boolean" }, { "const": "mixed" }] },
        "progress": {
          "type": "object",
          "properties": {
            "value": { "type": "number" },
            "max": { "type": "number" },
            "indeterminate": { "type": "boolean" }
          },
          "additionalProperties": false
        },
        "live": { "enum": ["off", "polite", "assertive"] },
        "scope": {
          "type": "object",
          "required": ["kind"],
          "properties": {
            "kind": { "enum": ["document", "modal", "popover", "menu"] },
            "trapsFocus": { "type": "boolean" },
            "obscuresBackground": { "type": "boolean" }
          },
          "additionalProperties": false
        },
        "window": {
          "type": "object",
          "required": ["start", "end", "total"],
          "properties": {
            "start": { "type": "integer", "minimum": 0 },
            "end": { "type": "integer", "minimum": 0 },
            "total": { "type": "integer", "minimum": 0 },
            "omittedBefore": { "type": "integer", "minimum": 0 },
            "omittedAfter": { "type": "integer", "minimum": 0 }
          },
          "additionalProperties": false
        },
        "position": {
          "type": "object",
          "properties": {
            "index": { "type": "integer", "minimum": 0 },
            "count": { "type": "integer", "minimum": 0 },
            "level": { "type": "integer", "minimum": 0 },
            "rowIndex": { "type": "integer", "minimum": 0 },
            "rowCount": { "type": "integer", "minimum": 0 },
            "columnIndex": { "type": "integer", "minimum": 0 },
            "columnCount": { "type": "integer", "minimum": 0 },
            "columnLabel": { "type": "string" },
            "group": { "type": "string" }
          },
          "additionalProperties": false
        },
        "description": { "type": "string" },
        "children": { "type": "array", "items": { "$ref": "#/$defs/accessibleNode" } }
      },
      "additionalProperties": false
    }
  }
}
