{
  "diagnostics": [],
  "focusPath": [],
  "root": {
    "children": [
      {
        "id": "richText-2-2",
        "label": "richText-2-2",
        "role": "text",
        "value": "Layout"
      },
      {
        "children": [
          {
            "children": [
              {
                "children": [
                  {
                    "disabled": false,
                    "id": "tabs:overview",
                    "label": "Overview",
                    "role": "menuitem",
                    "selected": true
                  },
                  {
                    "disabled": false,
                    "id": "tabs:details",
                    "label": "Details",
                    "role": "menuitem",
                    "selected": false
                  }
                ],
                "id": "tabs",
                "label": "tabs",
                "role": "menu"
              },
              {
                "children": [
                  {
                    "id": "text-3-67",
                    "label": "text-3-67",
                    "role": "text",
                    "value": "Inspector panel"
                  }
                ],
                "id": "inspector",
                "label": "inspector",
                "role": "text"
              }
            ],
            "id": "splitPane-2-2",
            "label": "splitPane-2-2",
            "role": "text"
          },
          {
            "children": [
              {
                "id": "text-14-33",
                "label": "text-14-33",
                "role": "text",
                "value": "Modal focus scope"
              }
            ],
            "id": "layout-modal",
            "label": "Dialog",
            "role": "dialog",
            "scope": {
              "kind": "modal",
              "obscuresBackground": true,
              "trapsFocus": true
            }
          }
        ],
        "id": "overlay-2-2",
        "label": "overlay-2-2",
        "role": "application",
        "scope": {
          "kind": "popover"
        }
      }
    ],
    "id": "layout-gallery",
    "label": "layout-gallery",
    "role": "text"
  },
  "schemaVersion": "terminal-ui.accessible-snapshot.v1",
  "source": "tui"
}
