{
  "diagnostics": [],
  "focusPath": [],
  "root": {
    "children": [
      {
        "id": "richText-2-2",
        "label": "richText-2-2",
        "role": "text",
        "value": "Canvas"
      },
      {
        "id": "canvas-gallery",
        "label": "Canvas primitives",
        "role": "application",
        "scope": {
          "kind": "document"
        }
      }
    ],
    "id": "canvas-gallery",
    "label": "canvas-gallery",
    "role": "text"
  },
  "schemaVersion": "terminal-ui.accessible-snapshot.v1",
  "source": "tui"
}
